{
  "schema_version": "1.0",
  "entity": "perspective_story",
  "id": "story.two_tailors_and_one_measure",
  "revision": 1,
  "status": "draft",
  "language": "vi",
  "title_vi": "Hai người thợ may và một thước đo",
  "subtitle_vi": "Một con số có thể vừa vặn với người này và làm người khác không thở nổi.",
  "hero_image": null,
  "primary_theme": "self_understanding",
  "metadata": {
    "concept_ids": [
      "concept.comparison"
    ],
    "emotion_tags": [
      "envy",
      "self_doubt"
    ],
    "keywords": [
      "so sánh",
      "thước đo",
      "nhịp riêng",
      "học nghề"
    ],
    "story_style": "parable"
  },
  "sections": [
    {
      "id": "the_shared_table",
      "title_vi": "Chiếc bàn chung",
      "blocks": [
        {
          "id": "the_shared_table.1",
          "type": "paragraph",
          "text_vi": "Duyên và Lộc học may ở hai đầu cùng một chiếc bàn. Duyên cắt vải nhanh, có thể hoàn thành ba chiếc áo trong lúc Lộc còn đang sửa đường vai của chiếc thứ hai. Lộc lại nhớ rất rõ người khách nào thường cúi lưng, ai thích tay áo rộng và ai luôn cài thiếu một chiếc cúc."
        },
        {
          "id": "the_shared_table.2",
          "type": "paragraph",
          "text_vi": "Mỗi cuối ngày, xưởng ghi số áo hoàn thành lên một tấm bảng. Duyên thường có con số lớn hơn. Lộc bắt đầu nhìn sang đầu bàn bên kia nhiều hơn nhìn người đang đứng trước mình. Anh đếm tiếng kéo của Duyên, đo thời gian cô xỏ chỉ và giấu những chiếc áo cần sửa xuống dưới chồng vải."
        }
      ]
    },
    {
      "id": "one_set_of_numbers",
      "title_vi": "Một bộ số đo",
      "blocks": [
        {
          "id": "one_set_of_numbers.1",
          "type": "paragraph",
          "text_vi": "Một tuần trước phiên chợ, hai người nhận may áo cho hai chị em bán hoa. Duyên ghi số đo của người chị lên một mảnh giấy rồi cắt rất nhanh. Lộc thấy hai người có vóc dáng gần giống nhau. Muốn theo kịp, anh dùng luôn những con số ấy cho người em và bỏ qua lần thử áo đã hẹn."
        },
        {
          "id": "one_set_of_numbers.2",
          "type": "paragraph",
          "text_vi": "Sáng giao hàng, chiếc áo của người chị vừa vặn. Chiếc còn lại kéo căng ở vai và dài quá cổ tay. Người em cố cài cúc rồi hạ tay xuống vì không thể nâng nổi bó hoa. Lộc nhìn hai chiếc áo cùng được cắt từ một bộ số đo. Điều giúp anh đi nhanh hơn đã làm người mặc phải đứng yên."
        },
        {
          "id": "one_set_of_numbers.3",
          "type": "pull_quote",
          "text_vi": "Một chiếc áo vừa với người đứng cạnh không phải bằng chứng rằng nó phải vừa với mình.",
          "attribution_vi": null
        }
      ]
    },
    {
      "id": "remeasuring",
      "title_vi": "Đo lại",
      "blocks": [
        {
          "id": "remeasuring.1",
          "type": "paragraph",
          "text_vi": "Lộc tháo đường vai và xin đo lại. Người em có một bên vai thấp hơn vì nhiều năm gánh thúng hoa. Cánh tay cô cần khoảng rộng khác với chị mình. Những khác biệt ấy không hiện lên khi hai người đứng cạnh nhau ngoài chợ, nhưng hiện rõ dưới sợi thước dây."
        },
        {
          "id": "remeasuring.2",
          "type": "paragraph",
          "text_vi": "Duyên ở lại giúp anh kịp sửa áo. Cô thú nhận mình thường may nhanh vì đã làm nhiều năm ở tiệm của mẹ, nhưng vẫn hay cắt quá sát những loại vải mới. Lộc chưa từng thấy các mảnh vải cô bỏ đi trong ngăn bàn. Tấm bảng cuối ngày chỉ giữ số áo hoàn thành; nó không giữ số năm đôi tay đã luyện, loại việc mỗi người đang học hay điều mỗi người thường làm tốt."
        }
      ]
    },
    {
      "id": "two_notebooks",
      "title_vi": "Hai cuốn sổ",
      "blocks": [
        {
          "id": "two_notebooks.1",
          "type": "paragraph",
          "text_vi": "Sau phiên chợ, Duyên và Lộc vẫn ghi số áo lên bảng vì xưởng cần biết tiến độ. Nhưng mỗi người đặt thêm một cuốn sổ ở đầu bàn. Duyên ghi loại vải khiến cô phải cắt lại. Lộc ghi thời gian mình mất cho từng công đoạn và một chi tiết khách mặc thấy dễ chịu hơn sau khi sửa."
        },
        {
          "id": "two_notebooks.2",
          "type": "paragraph",
          "text_vi": "Có ngày Lộc vẫn khó chịu khi nghe kéo của Duyên chạy nhanh. Có ngày Duyên nhìn đường vai Lộc sửa rất đẹp và thấy mình chậm ở một kiểu khác. Họ không thôi nhìn nhau. Họ chỉ không còn dùng điều nhìn thấy ở người kia làm toàn bộ bản án cho đôi tay của mình."
        }
      ]
    },
    {
      "id": "the_same_tape",
      "title_vi": "Vẫn là sợi thước ấy",
      "blocks": [
        {
          "id": "the_same_tape.1",
          "type": "paragraph",
          "text_vi": "Mùa sau, hai chị em bán hoa quay lại. Lần này Lộc đo từng người, còn Duyên quan sát cách vai áo chuyển động khi họ nâng giỏ. Hai sợi thước trên bàn dài bằng nhau và dùng cùng những con số. Không sợi nào biết chiếc áo nào đẹp hơn."
        },
        {
          "id": "the_same_tape.2",
          "type": "paragraph",
          "text_vi": "Khi hai người khách bước ra, mỗi chiếc áo rơi theo một đường khác trên vai. Duyên và Lộc treo thước về hai đầu bàn rồi mở cuốn sổ của riêng mình. Chiếc bàn vẫn chung. Con đường đôi tay họ đang học thì không cần phải giống nhau mới có thể đi tiếp."
        }
      ]
    }
  ],
  "takeaway": {
    "title_vi": "Một điều để mang theo",
    "text_vi": "So sánh có thể cho mình một điểm tham chiếu, nhưng một kết quả nhìn thấy ở người khác không chứa toàn bộ bối cảnh, nhịp học và điều quan trọng với mình."
  },
  "authorship": {
    "author_id": null,
    "author_name": null,
    "source_label": "Bản thảo Selflo Story Studio",
    "source_url": null
  },
  "editorial": {
    "origin_type": "owner_curated_ai_assisted",
    "source_collection_id": "story_studio",
    "source_item_id": "coverage_batch_01_two_tailors_one_measure",
    "human_edited": false
  },
  "rights": {
    "status": "unverified",
    "note": "Bản thảo nguyên bản do AI hỗ trợ; cần owner biên tập và xác nhận quyền trước khi publish."
  },
  "review": {
    "status": "needs_owner_review",
    "reviewed_by": null,
    "reviewed_at": null
  }
}
