{
  "schema_version": "1.0",
  "entity": "perspective_story",
  "id": "story.boatman_and_second_mountain",
  "revision": 1,
  "status": "draft",
  "language": "vi",
  "title_vi": "Người chèo thuyền và ngọn núi thứ hai",
  "subtitle_vi": "Một hành trình nhỏ bắt đầu trong khi dòng sông quen thuộc vẫn tiếp tục.",
  "hero_image": null,
  "primary_theme": "change_growth",
  "metadata": {
    "concept_ids": [

    ],
    "emotion_tags": [
      "uncertainty",
      "hope"
    ],
    "keywords": [
      "thay đổi",
      "thử nghiệm",
      "con đường thứ hai"
    ],
    "story_style": "parable"
  },
  "sections": [
    {
      "id": "the_river",
      "title_vi": "Dòng sông",
      "blocks": [
        {
          "id": "the_river.1",
          "type": "paragraph",
          "text_vi": "Một buổi sáng, người chèo thuyền thức dậy trước khi mặt trời lên. Dòng sông vẫn như mọi ngày: những chiếc thuyền nối nhau rời bến, người trẻ chèo nhanh, người lớn tuổi chèo chậm nhưng chắc. Thi thoảng một chiếc thuyền lớn đi ngang, chở những người đã trở thành quản lý của cả đội thuyền. Ngày trước anh từng muốn đứng trên đó. Bây giờ anh không còn chắc nữa."
        },
        {
          "id": "the_river.2",
          "type": "paragraph",
          "text_vi": "Anh hỏi ông lão sửa lưới bên bờ rằng nếu mình chèo đủ lâu thì sẽ đi đến đâu. Ông lão nói cuối dòng sông có một bến lớn hơn, nơi người ta sẽ trao cho anh một chiếc thuyền lớn hơn. Khi anh hỏi rồi sao nữa, ông lão chỉ cười: rồi anh sẽ phải chèo nó."
        },
        {
          "id": "the_river.3",
          "type": "paragraph",
          "text_vi": "Ngày hôm ấy anh không xuống thuyền. Lần đầu tiên sau nhiều năm, anh đi bộ dọc theo bờ sông. Một người bán bánh cho anh biết quầy nhỏ của mình kiếm được ít hơn rất nhiều so với nghề chèo thuyền. Anh thất vọng và tiếp tục đi. Một con đường khác không tự nhiên trở nên đúng chỉ vì nó khác con đường cũ."
        }
      ]
    },
    {
      "id": "the_gardener",
      "title_vi": "Người làm vườn",
      "blocks": [
        {
          "id": "the_gardener.1",
          "type": "paragraph",
          "text_vi": "Xa hơn một chút, anh gặp một người từng chèo thuyền đang chăm khu vườn gần như chưa đem lại thu nhập. Người làm vườn chỉ vào một cái cây nhỏ đã bảy tuổi. Năm năm đầu, phần trên mặt đất của nó gần như không lớn."
        },
        {
          "id": "the_gardener.2",
          "type": "paragraph",
          "text_vi": "Ông dùng một cành cây vẽ xuống đất: phía trên là thân cây nhỏ, phía dưới là bộ rễ rộng. Nếu chỉ nhìn phần nhìn thấy được, người ta sẽ tưởng năm năm ấy không có tiến bộ. Nhưng cái cây đã dành thời gian đi xuống để sau này không dễ bị gió quật ngã."
        },
        {
          "id": "the_gardener.3",
          "type": "pull_quote",
          "text_vi": "Có những giai đoạn, thứ đang lớn lên nằm dưới mặt đất.",
          "attribution_vi": null
        }
      ]
    },
    {
      "id": "the_inn",
      "title_vi": "Quán trọ",
      "blocks": [
        {
          "id": "the_inn.1",
          "type": "paragraph",
          "text_vi": "Cuối ngày, người chèo thuyền đến một quán trọ dưới chân núi. Ở đó có một thương nhân từng phá sản, một người lính đã giải ngũ, một người từng điều hành hàng trăm người nhưng đang học làm đồ gốm, và một người phụ nữ từng bán công ty rồi học trồng nho. Họ đều từng rất giỏi một thứ, nhưng không ai còn chỉ sống bằng thứ đó."
        },
        {
          "id": "the_inn.2",
          "type": "paragraph",
          "text_vi": "Chủ quán chỉ qua cửa sổ. Ngọn núi thứ nhất cao, dốc và đông người; trên sườn núi là những ngọn đuốc đang tranh nhau đi lên. Ngọn thứ hai thấp hơn, không có đường rõ ràng và hầu như không thấy ai. Ngọn thứ nhất có tiền, nghề nghiệp, khả năng và sự công nhận. Ngọn thứ hai không có cùng một đích đến cho tất cả mọi người."
        },
        {
          "id": "the_inn.3",
          "type": "pull_quote",
          "text_vi": "Mỗi người có một ngọn núi thứ hai khác nhau.",
          "attribution_vi": "Chủ quán"
        }
      ]
    },
    {
      "id": "the_second_mountain",
      "title_vi": "Ngọn núi thứ hai",
      "blocks": [
        {
          "id": "the_second_mountain.1",
          "type": "paragraph",
          "text_vi": "Người chèo thuyền hỏi khi nào mình phải rời ngọn núi thứ nhất. Chủ quán nói anh không cần rời. Ban ngày anh vẫn có thể chèo thuyền; thỉnh thoảng anh chỉ cần đi sang phía bên kia để đào, dù chưa biết mình đang tìm gì."
        },
        {
          "id": "the_second_mountain.2",
          "type": "paragraph",
          "text_vi": "Từ đó, mỗi tuần anh dành một buổi thử điều mới. Anh làm một chiếc bàn mà chẳng ai mua, dạy một người trẻ chèo thuyền và nhận ra mình thích việc đó, mất tiền trong một vụ buôn bán nhỏ, viết những điều mình biết về dòng sông mà không ai đọc, rồi giúp một người thiết kế lại chiếc thuyền và được trả một ít tiền."
        },
        {
          "id": "the_second_mountain.3",
          "type": "paragraph",
          "text_vi": "Anh bắt đầu chú ý không chỉ tới thứ kiếm được nhiều tiền nhất, mà tới thứ khiến mình muốn quay lại làm lần nữa. Những thử nghiệm nhỏ không tạo ra một lối thoát tức thì. Chúng âm thầm tạo thêm lựa chọn."
        }
      ]
    },
    {
      "id": "return_to_the_river",
      "title_vi": "Trở lại dòng sông",
      "blocks": [
        {
          "id": "return_to_the_river.1",
          "type": "paragraph",
          "text_vi": "Nhiều năm sau, anh nhận ra mình không còn đóng chiếc bè từng định dùng để bỏ dòng sông. Anh chạy đến hỏi ông lão sửa lưới làm sao sang được bờ bên kia. Ông lão hỏi ai đã nói rằng anh nhất thiết phải sang đó."
        },
        {
          "id": "return_to_the_river.2",
          "type": "paragraph",
          "text_vi": "Trên sườn ngọn núi thứ hai đã có một căn nhà nhỏ, vài cái cây, một nhóm người trẻ đang học và một xưởng chứa những thứ anh đã làm trong nhiều năm. Anh từng nghĩ tự do là ngày mình đủ tiền để bỏ chiếc thuyền. Nhưng tự do đã bắt đầu sớm hơn, từ lúc chiếc thuyền không còn là con đường duy nhất."
        },
        {
          "id": "return_to_the_river.3",
          "type": "pull_quote",
          "text_vi": "Tự do bắt đầu từ ngày con đường hiện tại không còn là con đường duy nhất.",
          "attribution_vi": null
        },
        {
          "id": "return_to_the_river.4",
          "type": "paragraph",
          "text_vi": "Mặt trời lên và những mái chèo đầu tiên vang trên mặt nước. Người đàn ông cầm mái chèo bước xuống thuyền. Ngày hôm đó anh vẫn đi làm, nhưng không còn cảm thấy mình chỉ đang đi xuống một dòng sông đã được định sẵn."
        }
      ]
    }
  ],
  "takeaway": {
    "title_vi": "Một điều để mang theo",
    "text_vi": "Một con đường mới có thể bắt đầu bằng những lần thử nhỏ, trước cả khi mình sẵn sàng rời con đường quen thuộc."
  },
  "authorship": {
    "author_id": null,
    "author_name": null,
    "source_label": "Nguồn authoring riêng của owner",
    "source_url": null
  },
  "editorial": {
    "origin_type": "owner_curated_ai_assisted",
    "source_collection_id": "story_chatgpt",
    "source_item_id": "boatman_and_second_mountain",
    "human_edited": false
  },
  "rights": {
    "status": "unverified",
    "note": "Chưa xác nhận quyền phát hành; hero image để null cho tới khi có asset/provenance được duyệt."
  },
  "review": {
    "status": "needs_owner_review",
    "reviewed_by": null,
    "reviewed_at": null
  }
}
