{
  "schema_version": "1.1",
  "entity": "perspective_story",
  "id": "story.original_between_two_banks",
  "revision": 4,
  "status": "active",
  "language": "vi",
  "title_vi": "Người đứng giữa hai bờ",
  "subtitle_vi": "Có những lúc ta chưa thể rời con đường cũ, nhưng vẫn có thể bắt đầu mở thêm một lối đi.",
  "hero_image": null,
  "primary_theme": "change_growth",
  "metadata": {
    "concept_ids": [
      "concept.autonomous_motivation"
    ],
    "emotion_tags": [
      "uncertainty",
      "fatigue"
    ],
    "keywords": [
      "đổi nghề",
      "nguồn thu",
      "chiếc bè",
      "xây lựa chọn"
    ],
    "story_style": "parable"
  },
  "sections": [
    {
      "id": "section_02",
      "blocks": [
        {
          "id": "section_02.block_01",
          "type": "paragraph",
          "style": "dialogue_lead",
          "text_vi": "Có một người đã chèo thuyền trên một dòng sông hơn mười năm.\n\nLúc trẻ, anh chèo rất khỏe. Anh nghĩ:"
        },
        {
          "id": "section_02.block_02",
          "type": "paragraph",
          "style": "dialogue",
          "text_vi": "“Chỉ cần mình giỏi hơn, chèo nhanh hơn, rồi mình sẽ đến một nơi tốt.”"
        },
        {
          "id": "section_02.block_03",
          "type": "paragraph",
          "style": "narrative",
          "text_vi": "Và điều đó đúng trong nhiều năm."
        },
        {
          "id": "section_02.block_04",
          "type": "paragraph",
          "style": "narrative",
          "text_vi": "Anh học thêm nhiều điều.\nĐổi những chiếc thuyền tốt hơn.\nĐi xa hơn.\nCuộc sống cũng dần khá hơn."
        },
        {
          "id": "section_02.block_05",
          "type": "paragraph",
          "style": "dialogue_lead",
          "text_vi": "Nhưng đến một ngày, anh bắt đầu mệt.\n\nKhông phải vì anh không còn chèo nổi.\n\nMà vì anh bắt đầu tự hỏi:"
        },
        {
          "id": "section_02.block_06",
          "type": "paragraph",
          "style": "dialogue",
          "text_vi": "“Mình sẽ chèo như thế này đến bao giờ?”"
        },
        {
          "id": "section_02.block_07",
          "type": "paragraph",
          "style": "narrative",
          "text_vi": "Anh nhìn sang bờ bên kia.\n\nCó người sống bằng một quán nhỏ. Có người làm một nghề riêng. Có người tạo dựng một điều thuộc về mình. Có người vẫn chèo thuyền thuê, nhưng dành lại được nhiều ngày hơn cho cuộc sống.\n\nAnh cũng muốn sang."
        },
        {
          "id": "section_02.block_08",
          "type": "paragraph",
          "style": "narrative",
          "text_vi": "Nhưng có một điều khiến anh ngần ngại.\n\nAnh không biết bên kia có đủ để sống không.\n\nNếu bỏ chiếc thuyền hiện tại, anh có thể mất thứ đang nuôi mình mỗi ngày."
        },
        {
          "id": "section_02.block_09",
          "type": "paragraph",
          "style": "narrative",
          "text_vi": "Nếu tiếp tục chèo, anh lại sợ mình sẽ dùng những năm còn lại trên một con đường không còn thật sự muốn đi.\n\nAnh suy nghĩ rất lâu.\n\nCuối cùng anh nhận ra mình đã đặt sai câu hỏi."
        },
        {
          "id": "section_02.block_10",
          "type": "paragraph",
          "style": "dialogue_lead",
          "text_vi": "Anh luôn hỏi:"
        },
        {
          "id": "section_02.block_11",
          "type": "paragraph",
          "style": "dialogue",
          "text_vi": "“Tôi nên ở lại hay sang bờ bên kia?”"
        },
        {
          "id": "section_02.block_12",
          "type": "paragraph",
          "style": "narrative",
          "text_vi": "Nhưng anh không cần phải quyết định điều đó ngay hôm nay.\n\nMỗi ngày sau khi chèo xong, anh dành một ít thời gian đóng một chiếc bè nhỏ."
        },
        {
          "id": "section_02.block_13",
          "type": "paragraph",
          "style": "narrative",
          "text_vi": "Ngày đầu chỉ có một thanh gỗ.\n\nNhìn chẳng có ý nghĩa gì.\n\nMột tháng sau vẫn chưa thể qua sông."
        },
        {
          "id": "section_02.block_14",
          "type": "paragraph",
          "style": "narrative",
          "text_vi": "Nhưng sáu tháng sau, nó bắt đầu giống một chiếc bè.\n\nTrong thời gian đó, chiếc thuyền cũ vẫn cho anh thức ăn.\n\nAnh không còn yêu chiếc thuyền đó nữa."
        },
        {
          "id": "section_02.block_15",
          "type": "paragraph",
          "style": "dialogue_lead",
          "text_vi": "Nhưng anh cũng không ghét nó như trước.\n\nBởi vì trước đây anh nghĩ:"
        },
        {
          "id": "section_02.block_16",
          "type": "paragraph",
          "style": "dialogue",
          "text_vi": "“Tôi bị mắc kẹt ở đây.”"
        },
        {
          "id": "section_02.block_17",
          "type": "paragraph",
          "style": "dialogue_lead",
          "text_vi": "Còn bây giờ anh nghĩ:"
        },
        {
          "id": "section_02.block_18",
          "type": "pull_quote",
          "text_vi": "“Chiếc thuyền này đang nuôi tôi trong lúc tôi mở một lối đi khác.”",
          "attribution_vi": "Người chèo thuyền"
        },
        {
          "id": "section_02.block_19",
          "type": "paragraph",
          "style": "narrative",
          "text_vi": "Và từ ngày đó, cảm giác của anh thay đổi."
        }
      ],
      "title_vi": "Một lối đi khác"
    }
  ],
  "takeaway": {
    "title_vi": "Góc nhìn",
    "text_vi": "Không phải thay đổi nào cũng bắt đầu bằng một cuộc rời đi. Có những thay đổi bắt đầu từ việc âm thầm tạo thêm lựa chọn cho mình."
  },
  "authorship": {
    "author_id": null,
    "author_name": null,
    "source_label": "Nguyên văn owner cung cấp; chỉ chuyển sang cấu trúc Story Selflo",
    "source_url": null
  },
  "editorial": {
    "origin_type": "owner_curated_ai_assisted",
    "source_collection_id": "story_studio",
    "source_item_id": "original_between_two_banks",
    "human_edited": true
  },
  "rights": {
    "status": "selflo_owned",
    "note": "Nội dung gốc Selflo do owner cung cấp; owner xác nhận quyền phát hành ngày 2026-09-23."
  },
  "review": {
    "status": "approved",
    "reviewed_by": "owner:dungvo",
    "reviewed_at": "2026-09-27T07:08:27Z"
  },
  "reader_format": "editorial_v2",
  "reflection": {
    "prompts_vi": [
      "Điều gì đang nuôi sống bạn hôm nay nhưng không nhất thiết phải là con đường duy nhất của ngày mai?",
      "Một bước nhỏ nào có thể giúp bạn tạo thêm lựa chọn mà chưa cần phá bỏ điều đang có?"
    ],
    "closing_vi": "Mình có thể chưa sang bờ bên kia, nhưng vẫn có thể bắt đầu mở một lối đi."
  }
}
