{
  "schema_version": "1.0",
  "entity": "perspective_story",
  "id": "story.photograph_missing_a_corner",
  "revision": 3,
  "status": "active",
  "language": "vi",
  "title_vi": "Bức ảnh thiếu một góc",
  "subtitle_vi": "Mai phục chế ảnh cũ trong một cửa tiệm ít người để ý, cho đến khi một khuôn mặt cần được nhìn lại.",
  "hero_image": null,
  "primary_theme": "work_achievement",
  "metadata": {
    "concept_ids": [

    ],
    "emotion_tags": [
      "doubt",
      "quiet_pride"
    ],
    "keywords": [
      "phục chế ảnh",
      "nghề thủ công",
      "ký ức gia đình",
      "sáng tạo",
      "công việc thầm lặng"
    ],
    "story_style": "contemporary"
  },
  "sections": [
    {
      "id": "the_small_shop",
      "title_vi": "Cửa tiệm dưới cầu thang",
      "blocks": [
        {
          "id": "the_small_shop.block_01",
          "type": "paragraph",
          "text_vi": "Mai làm trong một cửa tiệm ảnh nằm dưới cầu thang của khu thương mại cũ."
        },
        {
          "id": "the_small_shop.block_02",
          "type": "paragraph",
          "text_vi": "Biển hiệu ngoài cửa ghi đủ thứ: chụp thẻ, in màu, ép nhựa, phục chế ảnh cũ."
        },
        {
          "id": "the_small_shop.block_03",
          "type": "paragraph",
          "text_vi": "Phần lớn ngày của cô trôi qua với những tấm ảnh căn cước cần lấy gấp và những file khách gửi sai kích thước."
        },
        {
          "id": "the_small_shop.block_04",
          "type": "paragraph",
          "text_vi": "Bạn bè cùng lớp thiết kế của Mai đã làm ở studio lớn, đăng những bộ ảnh có đèn đẹp và người mẫu mặc quần áo lạ mắt."
        },
        {
          "id": "the_small_shop.block_05",
          "type": "paragraph",
          "text_vi": "Mai thường tránh kể rằng mình dành cả buổi sáng để xóa một vết mốc trên bức ảnh gia đình không ai ngoài chủ nhân của nó biết đến."
        }
      ]
    },
    {
      "id": "missing_corner",
      "title_vi": "Góc ảnh đã mất",
      "blocks": [
        {
          "id": "missing_corner.block_01",
          "type": "paragraph",
          "text_vi": "Một ngày mưa, hai bà cháu mang đến một tấm ảnh chỉ lớn hơn bàn tay."
        },
        {
          "id": "missing_corner.block_02",
          "type": "paragraph",
          "text_vi": "Giấy ảnh cong, một góc đã rách mất."
        },
        {
          "id": "missing_corner.block_03",
          "type": "paragraph",
          "text_vi": "Trong ảnh có ba người đứng trước căn nhà mái tôn."
        },
        {
          "id": "missing_corner.block_04",
          "type": "paragraph",
          "text_vi": "Gương mặt người phụ nữ ở giữa bị đường gấp chạy qua, còn bàn tay của bà biến mất cùng góc giấy."
        },
        {
          "id": "missing_corner.block_05",
          "type": "paragraph",
          "text_vi": "Người bà nói đó là tấm duy nhất chụp cùng chị gái trước khi mỗi người chuyển đi một nơi."
        },
        {
          "id": "missing_corner.block_06",
          "type": "paragraph",
          "text_vi": "Tuần sau gia đình làm lễ giỗ, bà muốn đặt ảnh lên bàn để mấy đứa nhỏ biết mặt người đã mất."
        },
        {
          "id": "missing_corner.block_07",
          "type": "paragraph",
          "text_vi": "Bà không yêu cầu bức ảnh phải mới."
        },
        {
          "id": "missing_corner.block_08",
          "type": "paragraph",
          "text_vi": "Bà chỉ hỏi liệu có thể nhìn rõ nụ cười hay không."
        },
        {
          "id": "missing_corner.block_09",
          "type": "paragraph",
          "text_vi": "Mai báo rằng phần góc mất không thể biết chính xác đã từng có gì."
        },
        {
          "id": "missing_corner.block_10",
          "type": "paragraph",
          "text_vi": "Cô có thể dựng lại một khoảng áo và nền nhà dựa trên phần còn lại, nhưng sẽ không bịa thêm bàn tay."
        },
        {
          "id": "missing_corner.block_11",
          "type": "paragraph",
          "text_vi": "Người bà gật đầu: Giữ điều mình còn biết là được."
        }
      ]
    },
    {
      "id": "hours_no_one_sees",
      "title_vi": "Những giờ không ai nhìn thấy",
      "blocks": [
        {
          "id": "hours_no_one_sees.block_01",
          "type": "paragraph",
          "text_vi": "Mai làm sau khi cửa tiệm đóng."
        },
        {
          "id": "hours_no_one_sees.block_02",
          "type": "paragraph",
          "text_vi": "Cô phóng lớn từng vùng, giữ lại hạt ảnh cũ thay vì làm da người trở nên trơn láng."
        },
        {
          "id": "hours_no_one_sees.block_03",
          "type": "paragraph",
          "text_vi": "Có lúc cô sửa quá tay khiến nụ cười thành một khuôn mặt khác."
        },
        {
          "id": "hours_no_one_sees.block_04",
          "type": "paragraph",
          "text_vi": "Cô quay lại bản trước và bắt đầu từ vết gấp."
        },
        {
          "id": "hours_no_one_sees.block_05",
          "type": "paragraph",
          "text_vi": "Đến gần nửa đêm, trên màn hình vẫn còn một góc trống."
        },
        {
          "id": "hours_no_one_sees.block_06",
          "type": "paragraph",
          "text_vi": "Mai không lấp nó bằng một chi tiết đẹp."
        },
        {
          "id": "hours_no_one_sees.block_07",
          "type": "paragraph",
          "text_vi": "Cô nối đường mái tôn, để phần tay áo dừng ở nơi tấm ảnh không còn dữ liệu, rồi chọn một màu xám gần với thời gian hơn là màu trắng sạch."
        },
        {
          "id": "hours_no_one_sees.block_08",
          "type": "paragraph",
          "text_vi": "Công việc ấy sẽ không có chữ ký."
        },
        {
          "id": "hours_no_one_sees.block_09",
          "type": "paragraph",
          "text_vi": "Người xem không biết bao nhiêu lần cô đã phóng lớn con mắt, sửa một sợi tóc rồi trả nó về chỗ cũ."
        },
        {
          "id": "hours_no_one_sees.block_10",
          "type": "paragraph",
          "text_vi": "Nhưng khi in thử, ba gương mặt đứng lại với nhau mà không ai trông như vừa được thay bằng một người khác."
        },
        {
          "id": "hours_no_one_sees.block_11",
          "type": "pull_quote",
          "text_vi": "Có những nghề chỉ làm đúng khi bàn tay người làm gần như biến mất khỏi kết quả.",
          "attribution_vi": null
        }
      ]
    },
    {
      "id": "the_family_table",
      "title_vi": "Trên bàn của một gia đình",
      "blocks": [
        {
          "id": "the_family_table.block_01",
          "type": "paragraph",
          "text_vi": "Tuần sau, hai bà cháu quay lại."
        },
        {
          "id": "the_family_table.block_02",
          "type": "paragraph",
          "text_vi": "Đứa bé cầm tấm ảnh mới bằng hai tay."
        },
        {
          "id": "the_family_table.block_03",
          "type": "paragraph",
          "text_vi": "Nó nhìn người phụ nữ ở giữa rồi nói nụ cười này giống bà ngoại lúc giấu quà."
        },
        {
          "id": "the_family_table.block_04",
          "type": "paragraph",
          "text_vi": "Người bà không nói gì một lúc."
        },
        {
          "id": "the_family_table.block_05",
          "type": "paragraph",
          "text_vi": "Bà chạm nhẹ vào góc ảnh vẫn còn một khoảng mờ và bảo: Đúng rồi, chỗ này mình không biết thì cứ để vậy."
        },
        {
          "id": "the_family_table.block_06",
          "type": "paragraph",
          "text_vi": "Sau khi họ đi, Mai trở lại xử lý một loạt ảnh thẻ."
        },
        {
          "id": "the_family_table.block_07",
          "type": "paragraph",
          "text_vi": "Cửa tiệm vẫn nhỏ."
        },
        {
          "id": "the_family_table.block_08",
          "type": "paragraph",
          "text_vi": "Cầu thang phía trên vẫn phát tiếng chân mỗi khi có người đi qua."
        },
        {
          "id": "the_family_table.block_09",
          "type": "paragraph",
          "text_vi": "Không có bài đăng nào về bức ảnh vừa rời khỏi máy in."
        },
        {
          "id": "the_family_table.block_10",
          "type": "paragraph",
          "text_vi": "Mai mở thư mục công việc, đặt tên bản cuối thật ngay ngắn rồi chuyển sang tấm ảnh cũ tiếp theo."
        },
        {
          "id": "the_family_table.block_11",
          "type": "paragraph",
          "text_vi": "Ở một nơi khác trong thành phố, bức ảnh thiếu một góc đã có mặt trên bàn của một gia đình."
        },
        {
          "id": "the_family_table.block_12",
          "type": "paragraph",
          "text_vi": "Chỉ điều đó thôi khiến đôi tay cô trở lại con chuột nhẹ hơn."
        }
      ]
    }
  ],
  "takeaway": {
    "title_vi": "Một điều để mang theo",
    "text_vi": "Giá trị của một nghề không chỉ nằm ở việc bao nhiêu người nhìn thấy nó. Có những công việc khiêm nhường trở nên có ý nghĩa vì một người đã làm phần nhỏ của mình thật cẩn thận."
  },
  "authorship": {
    "author_id": null,
    "author_name": null,
    "source_label": "Bản thảo Selflo Story Studio · Diversity Batch 01",
    "source_url": null
  },
  "editorial": {
    "origin_type": "owner_curated_ai_assisted",
    "source_collection_id": "story_studio",
    "source_item_id": "photograph_missing_a_corner",
    "human_edited": false
  },
  "rights": {
    "status": "public_domain",
    "note": "Tác phẩm và bản dịch nguồn được sử dụng là các văn bản cổ hoặc các ấn bản thuộc phạm vi công cộng. Nội dung tiếng Việt trong Selflo được dịch, diễn đạt hoặc biên soạn lại trực tiếp từ các nguồn đã dẫn để truyền tải trung thành ý nghĩa gốc; không sao chép từ các bản dịch tiếng Việt hiện đại có bản quyền."
  },
  "review": {
    "status": "approved",
    "reviewed_by": "owner:dungvo",
    "reviewed_at": "2026-09-13T01:41:15Z"
  }
}
