{
  "schema_version": "1.0",
  "entity": "perspective_story",
  "id": "story.chair_across_three_homes",
  "revision": 1,
  "status": "draft",
  "language": "vi",
  "title_vi": "Chiếc ghế đi qua ba căn nhà",
  "subtitle_vi": "Một chiếc ghế không đẹp, không đồng bộ và luôn là món đầu tiên bị đề nghị bỏ lại mỗi lần chuyển nhà.",
  "hero_image": null,
  "primary_theme": "meaning_values",
  "metadata": {
    "concept_ids": [
      "concept.meaning_in_life"
    ],
    "emotion_tags": [
      "nostalgia",
      "belonging"
    ],
    "keywords": [
      "gia đình",
      "nhiều thế hệ",
      "chuyển nhà",
      "chiếc ghế",
      "ký ức"
    ],
    "story_style": "reflective_journey"
  },
  "sections": [
    {
      "id": "the_first_house",
      "title_vi": "Căn nhà thứ nhất",
      "blocks": [
        {
          "id": "the_first_house.1",
          "type": "paragraph",
          "text_vi": "Chiếc ghế được mua cùng bộ bàn ăn khi vợ chồng bà Lệ mới ra riêng. Nó là chiếc lẻ, vì cửa hàng chỉ còn năm chiếc giống nhau. Lưng ghế thấp hơn, mặt gỗ sẫm hơn và một chân phải chêm bằng mảnh bìa để khỏi kêu."
        },
        {
          "id": "the_first_house.2",
          "type": "paragraph",
          "text_vi": "Khi con trai bà còn nhỏ, chiếc ghế được kê sát tường để nó đứng lên đọc bài. Những vạch bút chì đo chiều cao nằm sau lưng ghế. Đến bữa cơm đông người, ai đến muộn thường ngồi vào đó vì nó gần nồi cơm nhất."
        }
      ]
    },
    {
      "id": "the_second_house",
      "title_vi": "Căn nhà thứ hai",
      "blocks": [
        {
          "id": "the_second_house.1",
          "type": "paragraph",
          "text_vi": "Nhiều năm sau, gia đình chuyển vào chung cư. Bộ bàn cũ không vừa bếp mới nên được cho hàng xóm. Riêng chiếc ghế lẻ đi theo, dù không ai nhớ đã quyết định giữ nó lúc nào. Nó đứng cạnh cửa để bà Lệ ngồi mang giày, rồi trở thành chỗ đặt cặp của đứa cháu đầu tiên mỗi chiều đi học về."
        },
        {
          "id": "the_second_house.2",
          "type": "paragraph",
          "text_vi": "Mặt ghế có thêm một vết tròn do chiếc nồi nóng và một đường xước dài từ lần chuyển nhà. Con trai bà vài lần đề nghị mua ghế mới cho đồng bộ. Bà không phản đối, nhưng chiếc ghế mới thường được dùng ở bàn ăn, còn chiếc cũ vẫn nằm cạnh cửa vì bàn tay ai cũng quen tìm lưng ghế ấy khi cúi xuống buộc dây giày."
        }
      ]
    },
    {
      "id": "the_third_address",
      "title_vi": "Địa chỉ thứ ba",
      "blocks": [
        {
          "id": "the_third_address.1",
          "type": "paragraph",
          "text_vi": "Khi bà Lệ chuyển sang ở cùng con gái, căn hộ nhỏ chỉ đủ chỗ cho những thứ cần thiết. Hai chị em đứng giữa các thùng đồ, chia món nào mang theo, món nào cho đi. Chiếc ghế cũ bị đặt vào nhóm bỏ lại. Nó không phải đồ quý, cũng không còn chắc như trước."
        },
        {
          "id": "the_third_address.2",
          "type": "paragraph",
          "text_vi": "Đứa cháu gái đến giúp chuyển nhà ngồi thử lên ghế rồi phát hiện dưới mặt gỗ có tên mình viết bằng bút sáp từ hồi sáu tuổi. Bên cạnh là vài con số bà Lệ từng ghi vội khi nghe điện thoại. Không ai nhớ những con số ấy là gì. Nhưng chỉ một hàng chữ xiêu vẹo đã kéo cả căn bếp cũ trở lại: cặp sách dưới chân, đôi dép trước cửa và tiếng bà hỏi hôm nay ở lớp có vui không."
        },
        {
          "id": "the_third_address.3",
          "type": "paragraph",
          "text_vi": "Họ không biến chiếc ghế thành vật trưng bày. Người con trai siết lại ốc, thay mảnh bìa bằng miếng cao su và chở nó sang địa chỉ mới."
        },
        {
          "id": "the_third_address.4",
          "type": "pull_quote",
          "text_vi": "Có những vật ở lại không phải vì chúng chống được thời gian, mà vì thời gian đã đi qua chúng.",
          "attribution_vi": null
        }
      ]
    },
    {
      "id": "near_the_new_door",
      "title_vi": "Cạnh cánh cửa mới",
      "blocks": [
        {
          "id": "near_the_new_door.1",
          "type": "paragraph",
          "text_vi": "Ở căn nhà thứ ba, chiếc ghế lại đứng cạnh cửa. Bà Lệ ngồi trên đó khi mang giày đi khám, đứa cháu đặt túi rau lên đó mỗi lần ghé qua. Những chiếc ghế mới quanh bàn ăn vẫn đẹp và chắc hơn."
        },
        {
          "id": "near_the_new_door.2",
          "type": "paragraph",
          "text_vi": "Một hôm, đứa cháu đưa bạn về chơi. Người bạn hỏi sao nhà có một chiếc ghế chẳng giống gì với phần còn lại. Cô bé nhìn hàng chữ sáp dưới mặt ghế rồi trả lời: Vì nó biết đường về nhiều căn nhà nhất."
        },
        {
          "id": "near_the_new_door.3",
          "type": "paragraph",
          "text_vi": "Chiếc ghế không nghe câu ấy. Nó chỉ chịu thêm sức nặng của hai túi đồ và một người đang cúi xuống buộc dây giày, đúng công việc bình thường nó đã làm ở ba địa chỉ."
        }
      ]
    }
  ],
  "takeaway": {
    "title_vi": "Một điều để mang theo",
    "text_vi": "Ý nghĩa của một vật có thể được tạo nên bởi những người, hành động và ký ức đã tụ lại quanh nó, chứ không chỉ bởi chất liệu hoặc giá tiền."
  },
  "authorship": {
    "author_id": null,
    "author_name": null,
    "source_label": "Bản thảo Selflo Story Studio · Diversity Batch 02",
    "source_url": null
  },
  "editorial": {
    "origin_type": "owner_curated_ai_assisted",
    "source_collection_id": "story_studio",
    "source_item_id": "chair_across_three_homes",
    "human_edited": false
  },
  "rights": {
    "status": "unverified",
    "note": "Nội dung nguyên bản do Selflo Story Studio tạo cho Authoring Preview; cần owner biên tập và xác nhận quyền trước Release."
  },
  "review": {
    "status": "needs_owner_review",
    "reviewed_by": null,
    "reviewed_at": null
  }
}
